Symbol,Name,Last Sale,Net Change,% Change,Market Cap,Country,IPO Year,Volume,Sector,Industry
CTA^B,E.I. du Pont de Nemours and Company Preferred Stock,$110.3822,0.00,0.00%,,United States,,214,,
CTAC,Cerberus Telecom Acquisition Corp. Class A Ordinary Shares,$9.95,0.01,0.101%,330483907.00,United States,2020,15336,Finance,Business Services
CTBB,Qwest Corporation 6.5% Notes due 2056,$25.46,-0.04,-0.157%,0.00,United States,2016,29551,,
CTDD,Qwest Corporation 6.75% Notes due 2057,$26.61,0.00,0.00%,0.00,United States,2017,23206,,
CTK,CooTek (Cayman) Inc. American Depositary Shares each representing 50 Class A Ordinary Shares,$1.59,0.10,6.711%,102716674.00,,2018,190945,Technology,EDP Services
CTLT,Catalent Inc. Common Stock,$113.25,0.36,0.319%,19291180877.00,United States,2014,640828,Health Care,Major Pharmaceuticals
CTO,CTO Realty Growth Inc. Common Stock,$55.05,1.17,2.171%,328020324.00,United States,,20015,Consumer Services,Real Estate
CTO^A,CTO Realty Growth Inc. 6.375% Series A Cumulative Redeemable Preferred Stock,$25.69,0.18,0.706%,,United States,,108193,,
CTOS,Custom Truck One Source Inc. Common Stock,$8.86,-0.05,-0.561%,2184858794.00,Cayman Islands,2017,156706,Technology,Diversified Commercial Services
CTR,ClearBridge MLP and Midstream Total Return Fund Inc. Common Stock,$25.47,0.72,2.909%,184998467.00,United States,2012,25159,Finance,Investment Managers
CTS,CTS Corporation Common Stock,$35.93,0.66,1.871%,1162276575.00,United States,,93248,Capital Goods,Industrial Machinery/Components
CTT,CatchMark Timber Trust Inc. Class A Common Stock,$11.88,0.38,3.304%,580976324.00,United States,2013,145954,Consumer Services,Real Estate Investment Trusts
CTVA,Corteva Inc. Common Stock ,$43.45,0.55,1.282%,32027038450.00,,2019,3265596,Basic Industries,Major Chemicals
CUBB,Customers Bancorp Inc 5.375% Subordinated Notes Due 2034,$26.77,0.18,0.677%,0.00,United States,2019,5348,Finance,Major Banks
CUBE,CubeSmart Common Shares,$48.51,1.04,2.191%,9775579822.00,United States,,2095720,Consumer Services,Real Estate Investment Trusts
CUBI,Customers Bancorp Inc Common Stock,$40.19,2.27,5.986%,1296781150.00,United States,,254488,Finance,Major Banks
CUBI^C,Customers Bancorp Inc Fixed-to-Floating Rate Non-Cumulative Perpetual Preferred Stock Series C,$25.54,-0.044,-0.172%,,United States,,500,,
CUBI^D,Customers Bancorp Inc Fixed-to-Floating Rate Non-Cumulative Perpetual Preferred Stock Series D,$25.4366,-0.0508,-0.199%,,United States,,2000,,
CUBI^E,Customers Bancorp Inc Fixed-to-Floating Rate Non-Cumulative Perpetual Preferred Stock Series E,$25.48,-0.10,-0.391%,,United States,,1216,,
CUBI^F,Customers Bancorp Inc Fixed-to-Floating Rate Non-Cumulative Perpetual Preferred Stock Series F,$25.44,0.085,0.335%,,United States,,909,,
CUK,Carnival Plc ADS ADS,$21.93,0.58,2.717%,24824760000.00,United States,,1343087,,
CULP,Culp Inc. Common Stock,$15.44,0.40,2.66%,190112720.00,United States,,9479,Basic Industries,Textiles
CURO,CURO Group Holdings Corp. Common Stock,$16.71,0.42,2.578%,695533347.00,,2017,144770,Finance,Diversified Financial Services
CURV,Torrid Holdings Inc. Common Stock,$24.40,-0.40,-1.613%,0.00,,2021,433822,,
CUZ,Cousins Properties Incorporated Common Stock,$38.08,1.06,2.863%,5660718007.00,United States,,644289,Consumer Services,Real Estate Investment Trusts
CVA,Covanta Holding Corporation Common Stock,$17.75,0.29,1.661%,2360267697.00,United States,,415199,,
CVE,Cenovus Energy Inc Common Stock,$9.12,0.15,1.672%,18399249573.00,Canada,,7317679,,
CVEO,Civeo Corporation (Canada) Common Shares,$19.80,0.70,3.665%,282998747.00,,2014,14742,,
CVI,CVR Energy Inc. Common Stock,$16.43,0.31,1.923%,1651717742.00,United States,2007,1124277,Energy,Integrated oil Companies
CVII,Churchill Capital Corp VII Class A Common Stock,$9.76,-0.01,-0.102%,1683600000.00,,2021,2097831,,
CVNA,Carvana Co. Class A Common Stock,$323.42,0.91,0.282%,26187974266.00,United States,2017,1252523,Consumer Services,Other Specialty Stores
CVS,CVS Health Corporation Common Stock,$81.32,1.10,1.371%,107063299270.00,United States,,3470316,Health Care,Medical/Nursing Services
CVX,Chevron Corporation Common Stock,$104.07,1.47,1.433%,200653118759.00,United States,,8565393,Energy,Integrated oil Companies
CW,Curtiss-Wright Corporation Common Stock,$121.83,2.85,2.395%,4987504926.00,United States,,146961,Capital Goods,Industrial Machinery/Components
CWEN,Clearway Energy Inc. Class C Common Stock,$26.90,0.44,1.663%,5429407445.00,United States,2015,471018,Public Utilities,Electric Utilities: Central
CWH,Camping World Holdings Inc. Class A Commom Stock,$39.55,1.57,4.134%,3502976841.00,United States,2016,671587,Capital Goods,Recreational Products/Toys
CWK,Cushman & Wakefield plc Ordinary Shares,$17.67,0.48,2.792%,3938818498.00,,2018,686617,Finance,Real Estate
CWT,California Water Service Group Common Stock,$57.96,0.64,1.117%,2946396600.00,United States,,134837,Public Utilities,Water Supply
CX,Cemex S.A.B. de C.V. Sponsored ADR,$8.40,0.26,3.194%,12372335405.00,Mexico,,5354300,Capital Goods,Building Materials
CXE,MFS High Income Municipal Trust Common Stock,$5.43,0.04,0.742%,171162011.00,United States,1989,77956,Finance,Investment Managers
CXH,MFS Investment Grade Municipal Trust Common Stock,$10.3446,0.0185,0.179%,94241840.00,United States,1989,14787,Finance,Investment Managers
CXM,Sprinklr Inc. Class A Common Stock,$22.37,2.79,14.249%,5549753749.00,,2021,1353369,,
CXP,Columbia Property Trust Inc. Common Stock,$17.17,0.33,1.96%,1972302876.00,United States,2013,568657,Consumer Services,Real Estate Investment Trusts
CXW,CoreCivic Inc. Common Stock,$10.42,0.00,0.00%,1253285465.00,United States,,995565,Consumer Services,Real Estate Investment Trusts
CYD,China Yuchai International Limited Common Stock,$15.86,-0.25,-1.552%,648012479.00,Singapore,1994,67901,Capital Goods,Construction/Ag Equipment/Trucks
CYH,Community Health Systems Inc. Common Stock,$16.02,0.43,2.758%,2116875495.00,United States,2000,1054766,,
D,Dominion Energy Inc. Common Stock,$75.55,-0.40,-0.527%,60932913660.00,United States,,2163319,Public Utilities,Electric Utilities: Central
DAC,Danaos Corporation Common Stock,$72.05,3.88,5.692%,1484160544.00,Greece,2006,295769,Transportation,Marine Transportation
DAL,Delta Air Lines Inc. Common Stock,$42.92,0.85,2.02%,27453643789.00,United States,,7691611,Transportation,Air Freight/Delivery Services
DAN,Dana Incorporated Common Stock ,$23.00,1.01,4.593%,3338297303.00,United States,,843378,Capital Goods,Auto Parts:O.E.M.
DAO,Youdao Inc. American Depositary Shares each representing one Class A Ordinary Share,$21.04,1.13,5.676%,2608559314.00,,2019,534361,Consumer Services,Other Consumer Services
DAR,Darling Ingredients Inc. Common Stock,$66.82,0.64,0.967%,10903165134.00,United States,,812194,Consumer Non-Durables,Farming/Seeds/Milling
DASH,DoorDash Inc. Class A Common Stock,$180.23,1.67,0.935%,58725756426.00,,2020,1093174,Capital Goods,Industrial Machinery/Components
DAVA,Endava plc American Depositary Shares (each representing one Class A Ordinary Share),$118.63,-0.35,-0.294%,6538570637.00,,2018,93773,Technology,EDP Services
DB,Deutsche Bank AG Common Stock,$12.55,0.54,4.496%,25938002794.00,Germany,,3359056,Finance,Commercial Banks
DBD,Diebold Nixdorf Incorporated Common Stock,$12.42,0.42,3.50%,971594952.00,United States,,267686,Technology,EDP Services
DBI,Designer Brands Inc. Class A Common Stock,$16.06,1.21,8.148%,1170262023.00,United States,,1212356,Consumer Services,Clothing/Shoe/Accessory Stores
DBL,DoubleLine Opportunistic Credit Fund Common Shares of Beneficial Interest,$19.90,0.07,0.353%,297943079.00,United States,2012,14300,,
DBRG,DigitalBridge Group Inc.,$7.69,0.16,2.125%,3746226856.00,United States,2014,1288302,Consumer Services,Real Estate Investment Trusts
DBRG^G,DigitalBridge Group Inc. 7.50% Series G ,$25.18,0.10,0.399%,,United States,,9120,,
DBRG^H,DigitalBridge Group Inc. 7.125% Series H ,$25.16,0.11,0.439%,,United States,,11386,,
DBRG^I,DigitalBridge Group Inc. 7.15% Series I ,$25.40,0.01,0.039%,,United States,,56034,,
DBRG^J,DigitalBridge Group Inc. 7.125% Series J ,$25.57,0.0942,0.37%,,United States,,70631,,
DCF,BNY Mellon Alcentra Global Credit Income 2024 Target Term Fund Inc. Common Stock,$9.43,-0.01,-0.106%,141102335.00,,2017,50923,Finance,Finance/Investors Services
DCI,Donaldson Company Inc. Common Stock,$65.22,1.13,1.763%,8190635178.00,United States,,420475,Capital Goods,Pollution Control Equipment
DCO,Ducommun Incorporated Common Stock,$53.66,1.58,3.034%,635849375.00,United States,,23640,Capital Goods,Military/Government/Technical
DCP,DCP Midstream  LP Common Units ,$30.57,0.54,1.798%,6369643826.00,United States,,524340,Public Utilities,Natural Gas Distribution
DCP^B,DCP Midstream LP 7.875% Series B Fixed-to-Floating Rate Cumulative Redeemable Perpetual Preferred Units,$25.01,-0.083,-0.331%,,United States,,15391,,
DCP^C,DCP Midstream LP 7.95% Series C Fixed-to-Floating Rate Cumulative Redeemable Perpetual Preferred Units,$24.80,0.0336,0.136%,,United States,,7774,,
DCUE,Dominion Energy Inc. 2019 Series A Corporate Units,$99.45,-0.43,-0.431%,0.00,United States,2019,8986,Public Utilities,Electric Utilities: Central
DD,DuPont de Nemours Inc. Common Stock,$78.48,1.86,2.428%,41762530529.00,,2017,2273051,Basic Industries,Major Chemicals
DDD,3D Systems Corporation Common Stock,$34.41,0.19,0.555%,4302962207.00,United States,,1935093,Technology,Computer peripheral equipment
DDF,Delaware Investments Dividend & Income Fund Inc. Common Stock,$10.98,-0.07,-0.633%,83570526.00,United States,1993,25008,Finance,Finance/Investors Services
DDL,Dingdong (Cayman) Limited American Depositary Shares (each two representing three Ordinary Shares),$25.19,-0.29,-1.138%,0.00,,2021,286152,,
DDS,Dillard's Inc. Common Stock,$183.64,3.93,2.187%,3882593825.00,United States,,190878,Consumer Services,Department/Specialty Retail Stores
DDT,Dillard's Capital Trust I,$26.83,0.14,0.525%,0.00,United States,,10014,Consumer Services,Department/Specialty Retail Stores
DE,Deere & Company Common Stock,$349.48,5.90,1.717%,109017522312.00,United States,,1325378,Capital Goods,Industrial Machinery/Components
DEA,Easterly Government Properties Inc. Common Stock,$21.55,0.35,1.651%,1807419037.00,United States,2015,399406,Consumer Services,Real Estate Investment Trusts
DECK,Deckers Outdoor Corporation Common Stock,$390.00,6.28,1.637%,10847078970.00,United States,1993,197648,Consumer Non-Durables,Shoe Manufacturing
DEH,D8 Holdings Corp. Class A Ordinary Shares,$9.91,0.00,0.00%,427368750.00,Hong Kong,2020,331679,Finance,Business Services
DEI,Douglas Emmett Inc. Common Stock,$34.18,0.96,2.89%,5997587090.00,United States,2006,495916,Consumer Services,Real Estate Investment Trusts
DELL,Dell Technologies Inc. Class C Common Stock ,$100.25,1.25,1.263%,76559938440.00,,2018,2603747,Technology,Computer Manufacturing
DEN,Denbury Inc. Common Stock,$72.00,0.55,0.77%,3600478296.00,,2020,400740,Energy,Oil & Gas Production
DEO,Diageo plc Common Stock,$190.46,1.39,0.735%,111301423337.00,United Kingdom,,233830,Consumer Non-Durables,Beverages (Production/Distribution)
DESP,Despegar.com Corp. Ordinary Shares,$12.95,0.36,2.859%,907786298.00,,2017,128298,Transportation,Other Consumer Services
DEX,Delaware Enhanced Global Dividend Common Shares of Beneficial Interest,$10.50,-0.08,-0.756%,124934240.00,United States,2007,68429,Finance,Finance Companies
DFIN,Donnelley Financial Solutions Inc. Common Stock ,$32.81,1.02,3.209%,1097992950.00,,2016,123334,Finance,Investment Managers
DFNS,LGL Systems Acquisition Corp. Common Stock,$9.99,0.01,0.10%,215409375.00,United States,2020,25075,,
DFP,Flaherty & Crumrine Dynamic Preferred and Income Fund Inc. Common Stock,$29.28,0.06,0.205%,562240065.00,,2013,19051,Finance,Investment Managers
DFS,Discover Financial Services Common Stock,$122.40,7.14,6.195%,37318233305.00,United States,,2698799,Finance,Finance: Consumer Services
DG,Dollar General Corporation Common Stock,$220.77,1.11,0.505%,52147086027.00,United States,2009,2009320,Consumer Services,Department/Specialty Retail Stores
DGNR,Dragoneer Growth Opportunities Corp. Class A Ordinary Shares,$9.99,0.02,0.201%,861637500.00,United States,2020,183811,Finance,Business Services
DGX,Quest Diagnostics Incorporated Common Stock,$135.04,1.17,0.874%,16416239825.00,United States,,699471,Health Care,Medical Specialities
DHF,BNY Mellon High Yield Strategies Fund Common Stock,$3.43,-0.06,-1.719%,249387370.00,United States,1998,270334,Finance,Finance Companies
DHI,D.R. Horton Inc. Common Stock,$89.57,0.48,0.539%,32288509513.00,United States,,2290383,Capital Goods,Homebuilding
DHR,Danaher Corporation Common Stock,$277.47,0.49,0.177%,197913486949.00,United States,,1663502,Capital Goods,Industrial Machinery/Components
DHR^A,Danaher Corporation 4.75% Mandatory Convertible Preferred Stock Series A,$1848.71,0.00,0.00%,,United States,,182,,
DHR^B,Danaher Corporation 5.00% Mandatory Convertible Preferred Stock Series B,$1516.33,0.00,0.00%,,United States,,3187,,
DHT,DHT Holdings Inc.,$6.30,0.07,1.124%,1080443725.00,Jersey,2005,1483521,Transportation,Marine Transportation
DHX,DHI Group Inc. Common Stock,$3.14,0.11,3.63%,163834722.00,United States,2007,184305,Technology,Diversified Commercial Services
DIAX,Nuveen Dow 30SM Dynamic Overwrite Fund Common Shares of Beneficial Interest,$16.99,0.15,0.891%,617873869.00,,2014,64361,Finance,Finance Companies
DIDI,DiDi Global Inc. American Depositary Shares (each four representing one Class A Ordinary Share),$12.03,0.82,7.315%,57677130956.00,,2021,108778758,,
DIN,Dine Brands Global Inc. Common Stock,$86.15,2.70,3.235%,1478104755.00,United States,,110174,Consumer Services,Restaurants
DIS,Walt Disney Company (The) Common Stock,$177.04,4.24,2.454%,321669651548.00,United States,,7870013,Consumer Services,Services-Misc. Amusement & Recreation
DK,Delek US Holdings Inc. Common Stock,$19.56,0.74,3.932%,1445009161.00,United States,2017,610991,Energy,Integrated oil Companies
DKL,Delek Logistics Partners L.P. Common Units representing Limited Partner Interests,$43.20,0.49,1.147%,1876752115.00,United States,2012,34234,Energy,Oil & Gas Production
DKS,Dick's Sporting Goods Inc Common Stock,$101.31,3.20,3.262%,9043880584.00,United States,2002,1021322,Consumer Services,Other Specialty Stores
DLB,Dolby Laboratories Common Stock,$100.51,2.15,2.186%,10187779034.00,United States,2005,208506,Technology,EDP Services
DLNG,Dynagas LNG Partners LP Common Units,$3.35,0.15,4.688%,123265953.00,Greece,,93625,,
DLNG^A,Dynagas LNG Partners LP 9.00% Series A Cumulative Redeemable Preferred Units,$25.75,-0.03,-0.116%,,Greece,,5455,,
DLNG^B,Dynagas LNG Partners LP 8.75% Series B Fixed to Floating Rate Cumulative Redeemable Perpetual Preferred Units liquidation preference $25.00 per Uni,$25.25,0.14,0.558%,,Greece,,7157,,
DLR,Digital Realty Trust Inc. Common Stock,$155.76,1.18,0.763%,43860098906.00,United States,2004,1279727,Consumer Services,Real Estate Investment Trusts
DLR^J,Digital Realty Trust Inc. 5.250% Series J Cumulative Redeemable Preferred Stock,$26.09,0.05,0.192%,,United States,,12029,,
DLR^K,Digital Realty Trust Inc. 5.850% Series K Cumulative Redeemable Preferred Stock par value $0.01 per share,$28.25,-0.09,-0.318%,,United States,,30992,,
DLR^L,Digital Realty Trust Inc. 5.200% Series L Cumulative Redeemable Preferred Stock,$28.04,-0.07,-0.249%,,United States,,16415,,
DLX,Deluxe Corporation Common Stock,$43.66,1.18,2.778%,1842520765.00,United States,,152197,Technology,Advertising
DLY,DoubleLine Yield Opportunities Fund Common Shares of Beneficial Interest,$19.99,0.04,0.201%,958436122.00,,2020,63014,Finance,Investment Managers
DM,Desktop Metal Inc. Class A Common Stock,$10.44,-0.23,-2.156%,2670308925.00,,2019,3911998,Technology,Computer peripheral equipment
DMB,BNY Mellon Municipal Bond Infrastructure Fund Inc. Common Stock,$15.20,0.10,0.662%,279516494.00,,2013,44800,Finance,Trusts Except Educational Religious and Charitable
DMO,Western Asset Mortgage Opportunity Fund Inc. Common Stock,$15.85,-0.02,-0.126%,174779757.00,United States,2010,71916,Finance,Trusts Except Educational Religious and Charitable
DMS,Digital Media Solutions Inc. Class A Ordinary Shares,$9.35,-0.07,-0.743%,572978874.00,United States,2018,17123,Technology,Advertising
DMYI,dMY Technology Group Inc. III Class A Common Stock,$10.50,0.08,0.768%,393750000.00,United States,2021,325520,Technology,EDP Services
DMYQ,dMY Technology Group Inc. IV Class A Common Stock,$9.90,-0.05,-0.503%,426937500.00,,2021,853624,,
DNB,Dun & Bradstreet Holdings Inc. Common Stock,$21.27,-0.16,-0.747%,9176075854.00,United States,2020,1987172,Technology,EDP Services
DNMR,Danimer Scientific Inc. Common Stock,$25.00,0.58,2.375%,2138412875.00,,2020,708484,Consumer Non-Durables,Plastic Products
DNOW,NOW Inc. Common Stock,$9.40,0.42,4.677%,1036397028.00,,2014,489679,Energy,Metal Fabrications
DNP,DNP Select Income Fund Inc. Common Stock,$10.57,0.01,0.095%,3590001533.00,United States,1987,442103,Finance,Investment Managers
DNZ,D and Z Media Acquisition Corp. Class A Common Stock,$9.69,0.03,0.311%,348234375.00,,2021,8701,,
DOC,Physicians Realty Trust Common Shares of Beneficial Interest,$18.64,0.37,2.025%,4016349896.00,United States,2013,1560634,Consumer Services,Real Estate Investment Trusts
DOCN,DigitalOcean Holdings Inc. Common Stock,$57.44,2.62,4.779%,6121005430.00,,2021,564979,Technology,Retail: Computer Software & Peripheral Equipment
DOCS,Doximity Inc. Class A Common Stock,$52.74,4.42,9.147%,9398664605.00,,2021,1174421,,
DOOR,Masonite International Corporation Ordinary Shares (Canada),$113.29,3.87,3.537%,2775696312.00,Canada,,162826,,
DOV,Dover Corporation Common Stock,$153.46,2.32,1.535%,22087079161.00,United States,,676345,Capital Goods,Industrial Machinery/Components
DOW,Dow Inc. Common Stock ,$63.08,1.67,2.719%,47120094001.00,,2019,5062489,Basic Industries,Major Chemicals
DPG,Duff & Phelps Utility and Infrastructure Fund Inc.,$14.67,0.20,1.382%,556430254.00,United States,2011,159522,Finance,Trusts Except Educational Religious and Charitable
DPZ,Domino's Pizza Inc Common Stock,$477.56,3.01,0.634%,18542887361.00,United States,2004,427225,Consumer Non-Durables,Food Distributors
DQ,DAQO New Energy Corp. American Depositary Shares each representing five ordinary shares,$67.80,-1.19,-1.725%,4984220724.00,China,2010,2413380,Technology,Semiconductors
DRD,DRDGOLD Limited American Depositary Shares,$10.38,0.07,0.679%,887608114.00,South Africa,,223229,Basic Industries,Precious Metals
DRE,Duke Realty Corporation Common Stock,$49.85,1.01,2.068%,18693015710.00,United States,,2418337,Consumer Services,Real Estate Investment Trusts
DRH,Diamondrock Hospitality Company Common Stock,$9.40,0.35,3.867%,1976366591.00,United States,2005,1859543,Consumer Services,Real Estate Investment Trusts
DRH^A,Diamondrock Hospitality Company 8.250% Series A Cumulative Redeemable Preferred Stock,$28.95,0.00,0.00%,,United States,,18881,,
DRI,Darden Restaurants Inc. Common Stock,$148.58,4.63,3.216%,19440604503.00,United States,,1132318,Consumer Services,Restaurants
DRQ,Dril-Quip Inc. Common Stock,$31.88,0.82,2.64%,1129498645.00,United States,1997,147592,Energy,Metal Fabrications
DRUA,Dominion Energy Inc. 2016 Series A 5.25% Enhanced Junior Subordinated Notes due 2076,$25.68,-0.034,-0.132%,0.00,United States,2016,22629,Public Utilities,Electric Utilities: Central
DS,Drive Shack Inc.,$2.88,0.03,1.053%,265162110.00,United States,,1669952,Consumer Services,Movies/Entertainment
DS^B,Drive Shack Inc. Preferred Series B,$25.42,-0.08,-0.314%,,United States,,502,,
DS^D,Drive Shack Inc. Pfd Ser D,$25.00,0.00,0.00%,,United States,,500,,
DSL,DoubleLine Income Solutions Fund Common Shares of Beneficial Interests,$18.30,0.15,0.826%,1866541952.00,,2013,172682,Finance,Trusts Except Educational Religious and Charitable
DSM,BNY Mellon Strategic Municipal Bond Fund Inc. Common Stock,$8.41,0.00,0.00%,415634908.00,United States,1989,75811,Finance,Investment Managers
DSSI,Diamond S Shipping Inc. Common Stock ,$9.92,0.08,0.813%,402879085.00,,2019,254110,Consumer Services,Transportation Services
DSU,Blackrock Debt Strategies Fund Inc. Common Stock,$11.49,0.06,0.525%,535339862.00,United States,1998,75155,Finance,Finance Companies
DSX,Diana Shipping inc. common stock,$4.47,0.18,4.196%,409161459.00,Greece,2005,967321,Transportation,Marine Transportation
DSX^B,Diana Shipping Inc. Perpetual Preferred Shares Series B (Marshall Islands),$26.3399,0.1599,0.611%,,Greece,,2908,,
DT,Dynatrace Inc. Common Stock,$61.81,1.27,2.098%,17532663321.00,United States,2019,1059797,Technology,EDP Services
DTB,DTE Energy Company 2020 Series G 4.375% Junior Subordinated Debentures due 2080,$26.46,0.07,0.265%,0.00,United States,2020,23271,Public Utilities,Electric Utilities: Central
DTE,DTE Energy Company Common Stock,$115.60,1.37,1.199%,22394882932.00,United States,,1127498,Public Utilities,Electric Utilities: Central
DTF,DTF Tax-Free Income Inc. Common Stock,$15.00,-0.063,-0.418%,105443505.00,United States,1991,8136,Finance,Investment Managers
DTLA^,Brookfield DTLA Inc. 7.625% Series A Cumulative Redeemable Preferred Stock,$14.28,0.22,1.565%,,,,1684,,
DTM,DT Midstream Inc. Common Stock ,$40.18,0.48,1.209%,0.00,,2021,4892014,,
DTP,DTE Energy Company 6.25% Corporate Units,$51.45,0.18,0.351%,0.00,United States,,11406,Public Utilities,Electric Utilities: Central
DTW,DTE Energy Company 2017 Series E 5.25% Junior Subordinated Debentures due 2077,$26.52,-0.02,-0.075%,0.00,United States,2017,9966,Public Utilities,Electric Utilities: Central
DTY,DTE Energy Company 2016 Series F 6.00% Junior Subordinated Debentures due 2076,$25.70,-0.055,-0.214%,0.00,United States,2016,17598,,
DUK,Duke Energy Corporation (Holding Company) Common Stock,$100.66,0.10,0.099%,77429580111.00,United States,,2676306,Public Utilities,Power Generation
DUK^A,Duke Energy Corporation Depositary Shares each representing a 1/1000th interest in a share of 5.75% Series A Cumulative Redeemable Perpetual Preferred Stock,$28.50,-0.05,-0.175%,,United States,,97794,,
DUKB,Duke Energy Corporation 5.625% Junior Subordinated Debentures due 2078,$27.52,-0.04,-0.145%,0.00,United States,2018,50639,Public Utilities,Power Generation
DUKH,Duke Energy Corporation 5.125% Junior Subordinated Debentures due 2073,$26.58,0.04,0.151%,0.00,United States,,11385,Public Utilities,Power Generation
DV,DoubleVerify Holdings Inc. Common Stock,$40.21,1.09,2.786%,6321087916.00,,2021,236897,Technology,Computer Software: Prepackaged Software
DVA,DaVita Inc. Common Stock,$122.09,1.37,1.135%,12965958000.00,United States,,454894,Health Care,Medical/Nursing Services
DVD,Dover Motorsports Inc. Common Stock,$2.2681,0.0181,0.804%,82662245.00,United States,1996,17235,Consumer Services,Services-Misc. Amusement & Recreation
DVN,Devon Energy Corporation Common Stock,$28.65,0.89,3.206%,19393185000.00,United States,,8806063,Energy,Oil & Gas Production
DWIN,Delwinds Insurance Acquisition Corp. Class A Common Stock,$9.80,0.00,0.00%,252729750.00,,2021,3713,,
DX,Dynex Capital Inc. Common Stock,$18.57,0.36,1.977%,593968562.00,United States,,619412,Consumer Services,Real Estate Investment Trusts
DX^C,Dynex Capital Inc. 6.900% Series C Fixed-to-Floating Rate Cumulative Redeemable Preferred Stock,$26.18,0.18,0.692%,,United States,,3453,,
DXC,DXC Technology Company Common Stock ,$39.73,0.54,1.378%,10156573148.00,,,2144048,Technology,EDP Services
DY,Dycom Industries Inc. Common Stock,$71.19,1.60,2.299%,2191135012.00,United States,,210798,Basic Industries,Water Supply
DYFN,Angel Oak Dynamic Financial Strategies Income Term Trust Common Shares of Beneficial Interest,$20.1939,-0.0061,-0.03%,81886265.00,,2020,5451,Finance,Finance/Investors Services
E,ENI S.p.A. Common Stock,$23.88,0.35,1.487%,42656242821.00,Italy,,92258,Energy,Oil & Gas Production
EAF,GrafTech International Ltd. Common Stock,$11.50,0.43,3.884%,3073544821.00,United States,2018,2537867,Consumer Durables,Metal Fabrications
EAI,Entergy Arkansas LLC First Mortgage Bonds 4.875% Series Due September 1 2066,$25.39,-0.06,-0.236%,0.00,United States,2016,9450,,
EARN,Ellington Residential Mortgage REIT Common Shares of Beneficial Interest,$11.58,0.51,4.607%,149596716.00,United States,2013,277134,Consumer Services,Real Estate Investment Trusts
EAT,Brinker International Inc. Common Stock,$60.90,1.23,2.061%,2786230906.00,United States,,506651,Consumer Services,Restaurants
EB,Eventbrite Inc. Class A Common Stock,$17.43,0.91,5.508%,1633526754.00,United States,2018,1306678,Technology,EDP Services
EBF,Ennis Inc. Common Stock,$20.51,0.15,0.737%,535378355.00,United States,,68945,Consumer Services,Office Equipment/Supplies/Services
EBR,Centrais Electricas Brasileiras S A American Depositary Shares (Each representing one Common Share),$8.17,0.07,0.864%,12818165535.00,,2016,243634,Public Utilities,Electric Utilities: Central
EBS,Emergent Biosolutions Inc. Common Stock,$60.15,1.08,1.828%,3223166502.00,United States,2006,380864,Health Care,Major Pharmaceuticals
EC,Ecopetrol S.A. American Depositary Shares,$14.48,0.15,1.047%,29768486948.00,Colombia,,738683,Energy,Oil & Gas Production
ECC           ,Eagle Point Credit Company Inc. Common Stock,$13.1117,-0.1383,-1.044%,444199995.00,United States,2014,181144,Finance,Trusts Except Educational Religious and Charitable
ECCB,Eagle Point Credit Company Inc. 7.75% Series B Term Preferred Stock due 2026,$25.445,-0.085,-0.333%,0.00,United States,2016,9312,Finance,Trusts Except Educational Religious and Charitable
ECCC,Eagle Point Credit Company Inc. 6.50% Series C Term Preferred Stock due 2031,$25.81,-0.94,-3.514%,0.00,United States,,1770,Finance,Trusts Except Educational Religious and Charitable
ECCW,Eagle Point Credit Company Inc. 6.75% Notes due 2031,$25.8792,-0.0008,-0.003%,0.00,United States,2021,57173,Finance,Trusts Except Educational Religious and Charitable
