Symbol,Name,Last Sale,Net Change,% Change,Market Cap,Country,IPO Year,Volume,Sector,Industry
IHC,Independence Holding Company Common Stock,$45.18,-0.76,-1.654%,661410306.00,United States,,6063,Finance,Life Insurance
IHD,Voya Emerging Markets High Income Dividend Equity Fund Common Shares,$7.86,0.06,0.769%,145624712.00,United States,2011,69086,Finance,Investment Managers
IHG,Intercontinental Hotels Group American Depositary Shares (Each representing one Ordinary Share),$67.00,1.61,2.462%,12275492904.00,United Kingdom,,46731,Consumer Services,Hotels/Resorts
IHIT,Invesco High Income 2023 Target Term Fund Common Shares of Beneficial Interest,$9.80,0.00,0.00%,235954492.00,United States,2016,36056,Finance,Investment Managers
IHTA,Invesco High Income 2024 Target Term Fund Common Shares of Beneficial Interest No par value per share,$9.82,-0.005,-0.051%,86237364.00,,2017,7410,Finance,Finance/Investors Services
IIAC,Investindustrial Acquisition Corp. Class A Ordinary Shares,$9.74,-0.06,-0.612%,490043750.00,United Kingdom,2021,23441,Finance,Business Services
IIF,Morgan Stanley India Investment Fund Inc. Common Stock,$24.88,0.24,0.974%,280502220.00,United States,1994,3949,Finance,Trusts Except Educational Religious and Charitable
IIIN,Insteel Industries Inc. Common Stock,$33.60,0.91,2.784%,649845638.00,United States,,103383,,
IIM,Invesco Value Municipal Income Trust Common Stock,$16.64,-0.01,-0.06%,783020460.00,United States,,113086,Finance,Investment Managers
IIPR,Innovative Industrial Properties Inc. Common Stock,$203.98,6.96,3.533%,4880490142.00,United States,2016,168261,Consumer Services,Real Estate
IIPR^A,Innovative Industrial Properties Inc. 9.00% Series A Cumulative Redeemable Preferred Stock,$35.6301,-0.7199,-1.98%,,United States,,1365,,
IMAX,Imax Corporation Common Stock,$19.85,0.31,1.586%,1178269778.00,Canada,,362848,Miscellaneous,Industrial Machinery/Components
IMPX,AEA-Bridges Impact Corp. Class A Ordinary Shares,$9.74,0.01,0.103%,487000000.00,,2020,56316,Finance,Business Services
INFO,IHS Markit Ltd. Common Shares,$113.52,-0.58,-0.508%,45250467388.00,Bermuda,1996,2004683,Technology,EDP Services
INFY,Infosys Limited American Depositary Shares,$21.34,0.39,1.862%,90604455042.00,India,,4808437,Technology,EDP Services
ING,ING Group N.V. Common Stock,$13.01,0.53,4.247%,50782304422.00,Netherlands,1997,3872021,Finance,Commercial Banks
INGR,Ingredion Incorporated Common Stock,$93.28,1.22,1.325%,6247469789.00,United States,,368767,Consumer Non-Durables,Farming/Seeds/Milling
INN,Summit Hotel Properties Inc. Common Stock,$9.16,0.27,3.037%,972070320.00,United States,2011,405454,Consumer Services,Real Estate Investment Trusts
INN^D,Summit Hotel Properties Inc. 6.45% Series D Cumulative Redeemable Preferred Stock,$25.3649,0.1749,0.694%,,United States,,501,,
INN^E,Summit Hotel Properties Inc. 6.250% Series E Cumulative Redeemable Preferred Stock,$26.20,0.20,0.769%,,United States,,14836,,
INS,Intelligent Systems Corporation Common Stock,$31.92,-0.03,-0.094%,283524612.00,United States,1992,16966,Technology,Retail: Computer Software & Peripheral Equipment
INSI,Insight Select Income Fund,$21.6364,0.2464,1.152%,231726601.00,United States,,12018,Finance,Investment Managers
INSP,Inspire Medical Systems Inc. Common Stock,$185.73,6.14,3.419%,5054368555.00,United States,1998,161829,Health Care,Biotechnology: Electromedical & Electrotherapeutic Apparatus
INSW,International Seaways Inc. Common Stock ,$19.05,0.16,0.847%,535057560.00,,2016,153440,Technology,Semiconductors
INSW^A,International Seaways Inc. 8.50% Senior Notes due June 30 2023,$25.81,0.01,0.039%,,,,111,,
INT,World Fuel Services Corporation Common Stock,$30.37,0.85,2.879%,1920447861.00,United States,,362675,Energy,Oil Refining/Marketing
INVH,Invitation Homes Inc. Common Stock,$39.90,0.52,1.32%,22649252317.00,United States,2017,4366282,Consumer Services,Real Estate Investment Trusts
IO,Ion Geophysical Corporation Common Stock,$1.79,0.03,1.705%,51572061.00,United States,,1023774,Energy,Oilfield Services/Equipment
IP,International Paper Company Common Stock,$62.24,0.91,1.484%,24381853036.00,United States,,1756747,Basic Industries,Paper
IPG,Interpublic Group of Companies Inc. (The) Common Stock,$33.08,1.15,3.602%,13012866436.00,United States,,2512284,Technology,Advertising
IPI,Intrepid Potash Inc Common Stock,$31.53,0.51,1.644%,423946169.00,United States,2008,119675,Basic Industries,Major Chemicals
IPOD,Social Capital Hedosophia Holdings Corp. IV Class A Ordinary Shares,$10.23,0.05,0.491%,588225000.00,United States,2020,227588,Finance,Business Services
IPOF,Social Capital Hedosophia Holdings Corp. VI Class A Ordinary Shares,$10.14,0.10,0.996%,1457625000.00,United States,2020,1084265,Finance,Business Services
IPVA,InterPrivate II Acquisition Corp. Class A Common Stock,$9.7026,0.0026,0.027%,313818469.00,,2021,1781,Finance,Business Services
IPVF,InterPrivate III Financial Partners Inc. Class A Common Stock,$9.74,0.04,0.412%,315028125.00,,2021,1950,Finance,Business Services
IQI,Invesco Quality Municipal Income Trust Common Stock,$13.75,-0.02,-0.145%,727152209.00,United States,,22224,Finance,Finance Companies
IQV,IQVIA Holdings Inc. Common Stock,$251.16,2.35,0.944%,48137620462.00,United States,2013,470576,Health Care,Biotechnology: Commercial Physical & Biological Resarch
IR,Ingersoll Rand Inc. Common Stock,$49.38,1.12,2.321%,20712579313.00,United States,2017,2387834,Capital Goods,Industrial Machinery/Components
IRL,New Ireland Fund Inc (The) Common Stock,$12.32,0.08,0.654%,59791449.00,United States,1990,1330,Finance,Trusts Except Educational Religious and Charitable
IRM,Iron Mountain Incorporated (Delaware)Common Stock REIT,$43.74,1.12,2.628%,12629097920.00,United States,,2331498,Consumer Services,Real Estate Investment Trusts
IRS,IRSA Inversiones Y Representaciones S.A. Common Stock,$4.69,0.40,9.324%,271427484.00,Argentina,,691940,Consumer Services,Homebuilding
IRT,Independence Realty Trust Inc. Common Stock,$18.97,0.40,2.154%,1937738303.00,United States,2013,332381,Consumer Services,Real Estate Investment Trusts
IS,ironSource Ltd. Class A Ordinary Shares,$10.30,-0.06,-0.579%,0.00,,2021,1125566,,
ISD,PGIM High Yield Bond Fund Inc.,$16.36,0.03,0.184%,544080021.00,United States,2012,154604,Finance,Trusts Except Educational Religious and Charitable
ISOS,Isos Acquisition Corporation Class A Ordinary Shares,$9.90,0.0395,0.401%,315361778.00,,2021,184123,,
IT,Gartner Inc. Common Stock,$256.87,2.64,1.038%,22110478004.00,United States,1993,480402,Finance,Diversified Commercial Services
ITCB,Itau CorpBanca American Depositary Shares (each representing 1500 shares of Common Stock no par value),$4.09,0.12,3.023%,1397162430.00,Chile,,26777,Finance,Commercial Banks
ITGR,Integer Holdings Corporation Common Stock,$93.04,0.89,0.966%,3068001908.00,United States,,72660,Health Care,Medical/Dental Instruments
ITT,ITT Inc. Common Stock ,$95.00,1.86,1.997%,8179500000.00,United States,2011,267992,Capital Goods,Fluid Controls
ITUB,Itau Unibanco Banco Holding SA American Depositary Shares (Each repstg 500 Preferred shares),$5.55,-0.01,-0.18%,54412951181.00,Brazil,,25560199,Finance,Major Banks
ITW,Illinois Tool Works Inc. Common Stock,$227.38,3.55,1.586%,71825415602.00,United States,,819898,Capital Goods,Industrial Machinery/Components
IVAN,Ivanhoe Capital Acquisition Corp. Class A Ordinary Shares,$10.43,0.09,0.87%,359835000.00,,2021,71410,Finance,Business Services
IVC,Invacare Corporation Common Stock,$8.19,0.08,0.986%,286282990.00,United States,,155091,Health Care,Industrial Specialties
IVH,Delaware Ivy High Income Opportunities Fund,$13.91,-0.04,-0.287%,230488700.00,,2013,134819,Finance,Investment Managers
IVR,INVESCO MORTGAGE CAPITAL INC Common Stock,$3.56,0.11,3.188%,1010675848.00,United States,2009,5308057,Consumer Services,Real Estate Investment Trusts
IVR^B,Invesco Mortgage Capital Inc. Preferred Series B Cum Fxd to Fltg,$24.99,0.05,0.20%,,United States,,7711,,
IVR^C,INVESCO MORTGAGE CAPITAL INC 7.5% Fixed-to-Floating Series C Cumulative Redeemable Preferred Stock Liquation Preference $25.00 per Share,$25.01,0.01,0.04%,,United States,,24823,,
IVZ,Invesco Ltd Common Stock,$26.33,1.16,4.609%,12150007173.00,United States,,2598106,Finance,Investment Managers
IX,Orix Corp Ads Common Stock,$86.75,4.38,5.317%,19935354817.00,Japan,,48120,Finance,Diversified Financial Services
J,Jacobs Engineering Group Inc. Common Stock,$134.65,2.35,1.776%,17533502667.00,United States,,423819,Capital Goods,Oilfield Services/Equipment
JAX,J. Alexander's Holdings Inc. Common Stock,$13.72,0.02,0.146%,207035856.00,,2015,267889,Consumer Services,Restaurants
JBGS,JBG SMITH Properties Common Shares ,$31.84,0.62,1.986%,4186932904.00,United States,2017,3412662,Consumer Services,Real Estate Investment Trusts
JBI,Janus International Group Inc. Common Stock,$13.23,0.14,1.07%,570543750.00,,2021,405724,,
JBK,Lehman ABS 3.50 3.50% Adjustable Corp Backed Tr Certs GS Cap I,$31.46,0.00,0.00%,0.00,United States,,1,Finance,Trusts Except Educational Religious and Charitable
JBL,Jabil Inc. Common Stock,$57.89,1.49,2.642%,8613914078.00,United States,1993,600432,Technology,Electrical Products
JBT,John Bean Technologies Corporation Common Stock,$134.96,2.32,1.749%,4285025212.00,United States,,273972,Capital Goods,Diversified Manufacture
JCE,Nuveen Core Equity Alpha Fund Nuveen Core Equity Alpha Fund Common Shares of Beneficial Interest,$16.74,0.22,1.332%,268330164.00,United States,2007,155494,Finance,Trusts Except Educational Religious and Charitable
JCI,Johnson Controls International plc Ordinary Share,$70.06,1.15,1.669%,50213059275.00,Switzerland,,4171742,Capital Goods,Auto Parts:O.E.M.
JCO,Nuveen Credit Opportunities 2022 Target Term Fund Common Shares of Beneficial Interest,$8.32,0.03,0.362%,230884093.00,United States,2017,45082,Finance,Trusts Except Educational Religious and Charitable
JDD,Nuveen Diversified Dividend and Income Fund Shares of Beneficial Interest,$10.57,0.07,0.667%,207896225.00,United States,2003,31068,Finance,Finance Companies
JEF,Jefferies Financial Group Inc. Common Stock,$31.93,0.92,2.967%,7885828508.00,United States,,2445850,Finance,Finance/Investors Services
JELD,JELD-WEN Holding Inc. Common Stock,$25.38,0.71,2.878%,2516791939.00,United States,2017,342463,,
JEMD,Nuveen Emerging Markets Debt 2022 Target Term Fund Common Shares of Beneficial Interest $0.01 par value per share,$8.13,-0.03,-0.368%,115828045.00,,2017,13474,Finance,Investment Managers
JEQ,Aberdeen Japan Equity Fund Inc.  Common Stock,$8.87,0.15,1.72%,118933705.00,United States,1992,12145,Finance,Finance Companies
JFR,Nuveen Floating Rate Income Fund Common Stock,$10.01,0.02,0.20%,569753865.00,United States,2004,233054,Finance,Trusts Except Educational Religious and Charitable
JGH,Nuveen Global High Income Fund Common Shares of Beneficial Interest,$16.13,0.01,0.062%,373851349.00,United States,2014,49423,Finance,Investment Managers
JHAA,Nuveen Corporate Income 2023 Target Term Fund,$9.9401,-0.0099,-0.099%,77785845.00,,2018,5999,Finance,Finance/Investors Services
JHB,Nuveen Corporate Income November 2021 Target Term Fund,$9.4199,-0.0001,-0.001%,526572872.00,,2016,66315,Finance,Investment Managers
JHG,Janus Henderson Group plc Ordinary Shares,$39.50,1.44,3.783%,6807824566.00,,2017,932582,Finance,Investment Managers
JHI,John Hancock Investors Trust Common Stock,$18.89,0.00,0.00%,164475702.00,United States,,24716,Finance,Trusts Except Educational Religious and Charitable
JHS,John Hancock Income Securities Trust Common Stock,$15.87,-0.09,-0.564%,184831288.00,United States,,8557,Finance,Finance Companies
JHX,James Hardie Industries plc American Depositary Shares (Ireland),$34.24,1.11,3.35%,15212451046.00,Ireland,,179419,Capital Goods,Building Materials
JILL,J. Jill Inc. Common Stock,$21.02,0.55,2.687%,209860296.00,,2017,50353,Consumer Non-Durables,Apparel
JKS,JinkoSolar Holding Company Limited American Depositary Shares (each representing 4 Common Shares),$56.76,-2.03,-3.453%,2706255953.00,China,2010,3106158,Technology,Semiconductors
JLL,Jones Lang LaSalle Incorporated Common Stock,$194.14,3.43,1.799%,9960773984.00,United States,,345938,Finance,Real Estate
JLS,Nuveen Mortgage and Income Fund,$21.11,-0.02,-0.095%,115839858.00,United States,2009,10753,Finance,Investment Managers
JMIA,Jumia Technologies AG American Depositary Shares each representing two Ordinary Shares,$25.92,0.36,1.408%,2555519777.00,,2019,3400450,Consumer Services,Catalog/Specialty Distribution
JMM,Nuveen Multi-Market Income Fund (MA),$7.466,-0.064,-0.85%,70645913.00,United States,,8099,Finance,Trusts Except Educational Religious and Charitable
JMP,JMP Group LLC Common Shares,$5.98,-0.16,-2.606%,118717908.00,United States,2007,49223,Finance,Investment Bankers/Brokers/Service
JNJ,Johnson & Johnson Common Stock,$169.75,0.67,0.396%,447018971509.00,United States,,6120367,Health Care,Major Pharmaceuticals
JNPR,Juniper Networks Inc. Common Stock,$27.62,0.37,1.358%,9052182114.00,United States,1999,2017338,Technology,Computer peripheral equipment
JOE,St. Joe Company (The) Common Stock,$44.61,1.37,3.168%,2626750511.00,United States,,81111,Consumer Services,Homebuilding
JOF,Japan Smaller Capitalization Fund Inc Common Stock,$9.00,0.15,1.695%,255005037.00,United States,1990,37537,Finance,Trusts Except Educational Religious and Charitable
JP,Jupai Holdings Limited American Depositary Shares each representing six ordinary shares,$1.59,0.05,3.247%,52828027.00,,2015,71612,Consumer Services,Other Consumer Services
JPC,Nuveen Preferred & Income Opportunities Fund,$10.03,0.08,0.804%,1036652144.00,United States,2003,133204,Finance,Investment Managers
JPI,Nuveen Preferred and Income Term Fund Common Shares of Beneficial Interest,$25.54,-0.01,-0.039%,581325926.00,,2012,31793,Finance,Finance Companies
JPM,JP Morgan Chase & Co. Common Stock,$155.77,4.83,3.20%,471535746006.00,United States,,13666242,Finance,Major Banks
JPM^C,J P Morgan Chase & Co Depositary Shares each representing a 1/400th interest in a share of 6.00% Non-Cumulative  Preferred Stock Series EE,$28.64,-0.08,-0.279%,,United States,,140906,,
JPM^D,J P Morgan Chase & Co Depositary Shares each representing a 1/400th  interest in a share of 5.75% Non-Cumulative  Preferred Stock Series DD,$28.33,-0.03,-0.106%,,United States,,83455,,
JPM^J,J P Morgan Chase & Co Depositary Shares each representing a 1/400th interest in a share of JPMorgan Chase & Co. 4.75% Non-Cumulative Preferred Stock Series GG,$27.49,-0.06,-0.218%,,United States,,179237,,
JPM^K,J P Morgan Chase & Co Depositary Shares each representing a 1/400th interest in a share of 4.55% Non-Cumulative Preferred Stock Series JJ,$26.61,-0.10,-0.374%,,United States,,184952,,
JPM^L,J P Morgan Chase & Co Depositary Shares each representing a 1/400th interest in a share of 4.625% Non-Cumulative Preferred Stock Series LL,$26.69,-0.04,-0.15%,,United States,,114387,,
JPS,Nuveen Preferred & Income Securities Fund,$10.02,0.06,0.602%,2041977273.00,United States,2002,248381,Finance,Investment Managers
JPT,Nuveen Preferred and Income 2022 Term Fund Common Shares of Beneficial Interest,$25.2182,0.0682,0.271%,172519522.00,United States,2017,9052,Finance,Trusts Except Educational Religious and Charitable
JQC,Nuveen Credit Strategies Income Fund Shares of Beneficial Interest,$6.66,0.01,0.15%,903157871.00,United States,2003,874391,Finance,Finance Companies
JRI,Nuveen Real Asset Income and Growth Fund Common Shares of Beneficial Interest,$16.23,0.09,0.558%,445573226.00,United States,2012,61032,Finance,Finance Companies
JRO,Nuveen Floating Rate Income Opportuntiy Fund Shares of Beneficial Interest,$9.78,0.03,0.308%,396493112.00,United States,2004,263050,Finance,Investment Managers
JRS,Nuveen Real Estate Income Fund Common Shares of Beneficial Interest,$11.36,-0.01,-0.088%,328218471.00,United States,2001,90911,Finance,Finance/Investors Services
JSD,Nuveen Short Duration Credit Opportunities Fund Common Shares of Beneficial Interest,$14.90,-0.04,-0.268%,150276155.00,United States,2011,22759,Finance,Finance Companies
JT,Jianpu Technology Inc. American depositary shares,$2.29,0.01,0.439%,48505346.00,,2017,234371,Technology,EDP Services
JTA,Nuveen Tax-Advantaged Total Return Strategy Fund Common Share of Beneficial Interest,$11.49,0.11,0.967%,159146807.00,United States,2004,44563,Finance,Finance Companies
JTD,Nuveen Tax-Advantaged Dividend Growth Fund Common Shares of Beneficial Interest,$16.07,0.15,0.942%,232763344.00,United States,,43728,Finance,Trusts Except Educational Religious and Charitable
JW/A,John Wiley & Sons Inc.,$59.18,0.56,0.955%,,United States,,207552,,
JW/B,John Wiley & Sons Inc.,$59.29,0.00,0.00%,,United States,,4,,
JWN,Nordstrom Inc. Common Stock,$36.00,2.24,6.635%,5720352336.00,United States,,2863805,Consumer Services,Clothing/Shoe/Accessory Stores
JWSM,Jaws Mustang Acquisition Corp. Class A Ordinary Shares,$9.79,-0.02,-0.204%,1266581250.00,,2021,933900,Finance,Business Services
K,Kellogg Company Common Stock,$64.28,0.28,0.438%,21887104478.00,United States,,1453000,Consumer Non-Durables,Packaged Foods
KAHC,KKR Acquisition Holdings I Corp. Class A Common Stock,$9.73,-0.03,-0.307%,1678425000.00,,2021,15070,,
KAI,Kadant Inc Common Stock,$178.27,4.30,2.472%,2063970841.00,United States,,10431,Technology,Industrial Machinery/Components
KAMN,Kaman Corporation Common Stock,$47.95,1.10,2.348%,1333492185.00,United States,,79272,Capital Goods,Military/Government/Technical
KAR,KAR Auction Services Inc Common Stock,$16.77,0.14,0.842%,2092243647.00,United States,2009,1065082,,
KB,KB Financial Group Inc,$45.09,0.01,0.022%,17568612165.00,South Korea,,323896,Finance,Commercial Banks
KBH,KB Home Common Stock,$39.83,1.00,2.575%,3934540512.00,United States,1986,1725476,,
KBR,KBR Inc. Common Stock,$39.21,0.74,1.924%,5542184463.00,United States,2006,1093708,Basic Industries,Military/Government/Technical
KCAC,Kensington Capital Acquisition Corp. II Class A Common Stock,$9.98,-0.01,-0.10%,286925000.00,,2021,29677,Finance,Business Services
KEN,Kenon Holdings Ltd. Ordinary Shares,$32.58,0.57,1.781%,1755381632.00,Singapore,2015,16402,Public Utilities,Electric Utilities: Central
KEP,Korea Electric Power Corporation Common Stock,$10.57,0.06,0.571%,13571120588.00,South Korea,1994,179178,Consumer Durables,Electrical Products
KEX,Kirby Corporation Common Stock,$60.35,1.84,3.145%,3627336750.00,United States,,406608,Transportation,Marine Transportation
KEY,KeyCorp Common Stock,$20.17,0.77,3.969%,19575377064.00,United States,,7741077,Finance,Major Banks
KEY^I,KeyCorp Depositary Shares Each Representing a 1/40th Ownership Interest in a Share of Fixed-to-Floating Rate Perpetual Non-Cumulative Preferred Stock Series E,$30.46,-0.03,-0.098%,,United States,,26371,,
KEY^J,KeyCorp Depositary Shares each representing a 1/40th ownership interest in a share of Fixed Rate Perpetual Non-Cumulative Preferred Stock Series F,$27.59,-0.10,-0.361%,,United States,,18714,,
KEY^K,KeyCorp Depositary Shares each representing a 1/40th ownership interest in a share of Fixed Rate Perpetual Non-Cumulative Preferred Stock Series G,$28.34,0.00,0.00%,,United States,,17211,,
KEYS,Keysight Technologies Inc. Common Stock,$155.81,1.64,1.064%,28704250879.00,United States,2014,475480,Capital Goods,Industrial Machinery/Components
KF,Korea Fund Inc. (The) New Common Stock,$44.895,0.335,0.752%,225371823.00,United States,,5882,Finance,Investment Managers
KFS,Kingsway Financial Services Inc. Common Stock (DE),$4.95,0.07,1.434%,117342873.00,Canada,,2844,,
KFY,Korn Ferry Common Stock,$69.02,2.09,3.123%,3727632160.00,United States,1999,258041,Technology,Diversified Commercial Services
KGC,Kinross Gold Corporation Common Stock,$6.30,0.10,1.613%,7945560000.00,Canada,,22034203,Basic Industries,Precious Metals
KIM,Kimco Realty Corporation Common Stock,$21.21,0.71,3.463%,9194869609.00,United States,,3575931,Consumer Services,Real Estate Investment Trusts
KIM^L,Kimco Realty Corporation Class L Depositary Shares each of which represents a one-one thousandth fractional interest in a share of 5.125% Class L Cumulative Redeemable Preferred Stock liquidation preference $25000.00 per share,$26.19,-0.05,-0.191%,,United States,,6692,,
KIM^M,Kimco Realty Corporation Class M Depositary Shares each of which represents a one-one thousandth fractional interest in a share of 5.25% Class M Cumulative Redeemable Preferred Stock liquidation preference $25000.00 per share,$26.80,-0.17,-0.63%,,United States,,18422,,
KIO,KKR Income Opportunities Fund Common Shares,$16.51,0.02,0.121%,335818601.00,,2013,49658,Finance,Investment Managers
KKR,KKR & Co. Inc. Common Stock,$59.10,1.07,1.844%,34383123830.00,United States,,1701452,Finance,Investment Managers
KKR^B,KKR & Co. Inc. 6.50% Series B Preferred Stock,$25.375,0.025,0.099%,,United States,,6731,,
KKR^C,KKR & Co. Inc. 6.00% Series C Mandatory Convertible Preferred Stock,$77.46,0.25,0.324%,,United States,,236673,,
KKRS,KKR Group Finance Co. IX LLC 4.625% Subordinated Notes due 2061,$26.00,0.04,0.154%,0.00,,2021,21197,,
KL,Kirkland Lake Gold Ltd. Common Shares,$39.42,0.95,2.469%,10528406893.00,,,1153652,,
KMB,Kimberly-Clark Corporation Common Stock,$135.02,-0.28,-0.207%,45560013012.00,United States,,1741672,Basic Industries,Paper
KMF,Kayne Anderson NextGen Energy & Infrastructure Inc.,$7.66,0.19,2.544%,361532559.00,,2010,224897,Finance,Investment Managers
KMI,Kinder Morgan Inc. Common Stock,$18.67,0.50,2.752%,42279756825.00,United States,2011,11695149,Public Utilities,Natural Gas Distribution
KMPR,Kemper Corporation,$71.02,1.15,1.646%,4585513256.00,United States,,202365,Finance,Life Insurance
KMT,Kennametal Inc. Common Stock,$36.38,0.88,2.479%,3041318851.00,United States,,435450,Capital Goods,Industrial Machinery/Components
KMX,CarMax Inc,$134.84,1.57,1.178%,21970163086.00,United States,,743718,Consumer Services,Other Specialty Stores
KN,Knowles Corporation Common Stock,$19.54,0.27,1.401%,1813184013.00,,2014,317280,Consumer Non-Durables,Consumer Electronics/Appliances
KNL,Knoll Inc. Common Stock,$25.50,0.13,0.512%,1296450804.00,United States,2004,632796,Consumer Durables,Office Equipment/Supplies/Services
KNOP,KNOT Offshore Partners LP Common Units representing Limited Partner Interests,$19.79,0.26,1.331%,647016120.00,United Kingdom,2013,67928,Transportation,Marine Transportation
KNX,Knight-Swift Transportation Holdings Inc.,$49.78,0.38,0.769%,8239120555.00,United States,2017,1592358,Transportation,Trucking Freight/Courier Services
KO,Coca-Cola Company (The) Common Stock,$54.46,0.33,0.61%,234784081201.00,United States,,10845527,Consumer Non-Durables,Beverages (Production/Distribution)
KODK,Eastman Kodak Company Common New,$8.11,0.10,1.248%,636663190.00,United States,,1055293,Miscellaneous,Business Services
KOF,Coca Cola Femsa S.A.B. de C.V.  American Depositary Shares each representing 10 Units (each Unit consists of 3 Series B Shares and 5 Series L Shares),$52.59,0.38,0.728%,11048276855.00,Mexico,1993,94716,Consumer Non-Durables,Beverages (Production/Distribution)
KOP,Koppers Holdings Inc. Koppers Holdings Inc. Common Stock,$31.35,0.85,2.787%,665900992.00,United States,2006,67891,Basic Industries,Industrial Specialties
KOS,Kosmos Energy Ltd. Common Shares (DE),$3.06,0.10,3.378%,1248627844.00,Bermuda,2011,5209283,Energy,Oil & Gas Production
KR,Kroger Company (The) Common Stock,$38.27,0.39,1.03%,28596801283.00,United States,,5030692,Consumer Services,Food Chains
KRA,Kraton Corporation Common Stock,$39.71,1.06,2.743%,1276440106.00,United States,2009,273293,Basic Industries,Major Chemicals
KRC,Kilroy Realty Corporation Common Stock,$70.75,2.22,3.239%,8238863678.00,United States,1997,545055,Consumer Services,Real Estate Investment Trusts
KREF,KKR Real Estate Finance Trust Inc. Common Stock,$21.42,0.57,2.734%,1191754822.00,United States,2017,418464,Consumer Services,Real Estate Investment Trusts
KREF^A,KKR Real Estate Finance Trust Inc. 6.50% Series A Cumulative Redeemable Preferred Stock,$26.975,-0.075,-0.277%,,United States,,11780,,
KRG,Kite Realty Group Trust Common Stock,$21.50,0.80,3.865%,1816437820.00,United States,2004,247658,Consumer Services,Real Estate Investment Trusts
KRO,Kronos Worldwide Inc Common Stock,$14.10,0.48,3.524%,1629152310.00,United States,,156300,Basic Industries,Major Chemicals
KRP,Kimbell Royalty Partners Common Units Representing Limited Partner Interests,$12.74,0.11,0.871%,765446693.00,United States,2017,142023,Energy,Oil & Gas Production
KSM,DWS Strategic Municipal Income Trust,$12.70,-0.07,-0.548%,142290051.00,United States,1989,22046,Finance,Trusts Except Educational Religious and Charitable
KSS,Kohl's Corporation Common Stock,$53.80,2.58,5.037%,8405338036.00,United States,1992,3097832,Consumer Services,Department/Specialty Retail Stores
KSU,Kansas City Southern Common Stock,$273.95,11.16,4.247%,24978792230.00,United States,,1825367,Transportation,Railroads
KSU^,Kansas City Southern Preferred Stock,$36.92,-0.54,-1.442%,,United States,,260,,
KT,KT Corporation Common Stock,$14.05,0.13,0.934%,6582178956.00,South Korea,,357128,Public Utilities,Telecommunications Equipment
KTB,Kontoor Brands Inc. Common Stock ,$58.31,3.02,5.462%,3360492473.00,,2019,466119,Consumer Non-Durables,Apparel
KTF,DWS Municipal Income Trust,$12.37,-0.03,-0.242%,488626603.00,United States,1988,30337,Finance,Finance Companies
KTH,Structures Products Cp 8% CorTS Issued by Peco Energy Cap Tr II Preferred Stock,$33.50,0.03,0.09%,0.00,United States,,274,Finance,Investment Managers
KTN,Structured Products Corp 8.205% CorTS 8.205% Corporate Backed Trust Securities (CorTS),$32.1825,-0.0175,-0.054%,0.00,United States,,1794,,
KUKE,Kuke Music Holding Limited American Depositary Shares each representing one Ordinary Share,$5.37,0.14,2.677%,158773303.00,,2021,69282,Consumer Services,Other Consumer Services
