Symbol,Name,Last Sale,Net Change,% Change,Market Cap,Country,IPO Year,Volume,Sector,Industry
PGR,Progressive Corporation (The) Common Stock,$99.63,1.14,1.157%,58313439000.00,United States,,3426354,Finance,Property-Casualty Insurers
PGRE,Paramount Group Inc. Common Stock,$10.12,0.29,2.95%,2215780032.00,United States,2014,1804115,Consumer Services,Real Estate Investment Trusts
PGTI,PGT Innovations Inc.,$22.89,0.94,4.282%,1362980632.00,United States,2006,1010945,Capital Goods,Building Products
PGZ,Principal Real Estate Income Fund Common Shares of Beneficial Interest,$15.31,0.15,0.989%,105123390.00,,2013,14077,Finance,Investment Managers
PH,Parker-Hannifin Corporation Common Stock,$311.57,4.69,1.528%,40209960784.00,United States,,649356,Capital Goods,Office Equipment/Supplies/Services
PHD,Pioneer Floating Rate Fund Inc.,$12.02,0.02,0.167%,297352851.00,United States,2004,29592,Finance,Investment Managers
PHG,Koninklijke Philips N.V. NY Registry Shares,$46.35,-0.03,-0.065%,42246831997.00,Netherlands,,1267316,Health Care,Biotechnology: Electromedical & Electrotherapeutic Apparatus
PHI,PLDT Inc. Sponsored ADR,$25.57,-0.06,-0.234%,5524546167.00,Philippines,,126171,Public Utilities,Telecommunications Equipment
PHK,Pimco High Income Fund Pimco High Income Fund,$6.83,-0.07,-1.014%,912480740.00,United States,2003,516622,Finance,Finance/Investors Services
PHM,PulteGroup Inc. Common Stock,$53.23,0.52,0.987%,13997686621.00,United States,,1881459,Capital Goods,Homebuilding
PHR,Phreesia Inc. Common Stock,$65.27,0.02,0.031%,3297415728.00,United States,2019,468242,Health Care,Managed Health Care
PHT,Pioneer High Income Fund Inc.,$9.92,0.09,0.916%,289979168.00,United States,,83532,Finance,Investment Managers
PHX,PHX Minerals Inc. Common Stock,$3.76,0.48,14.634%,114308392.00,United States,,688850,Energy,Oil & Gas Production
PIAI,Prime Impact Acquisition I Class A Ordinary Shares,$9.76,-0.01,-0.102%,330920754.00,,2020,25765,Finance,Business Services
PICC,Pivotal Investment Corporation III Class A Common Stock,$9.76,-0.02,-0.204%,336720000.00,,2021,118,,
PII,Polaris Inc. Common Stock,$136.15,2.84,2.13%,8338108647.00,United States,,450402,Consumer Non-Durables,Recreational Products/Toys
PIM,Putnam Master Intermediate Income Trust Common Stock,$4.22,0.01,0.238%,215953039.00,United States,1988,66649,Finance,Finance Companies
PINE,Alpine Income Property Trust Inc. Common Stock,$19.25,0.39,2.068%,209186016.00,United States,2019,42277,Consumer Services,Real Estate Investment Trusts
PING,Ping Identity Holding Corp. Common Stock,$23.97,0.10,0.419%,1967617360.00,United States,2019,563026,Technology,EDP Services
PINS,Pinterest Inc. Class A Common Stock,$76.99,1.11,1.463%,49031925772.00,,2019,7162781,,
PIPP,Pine Island Acquisition Corp. Class A Common Stock,$9.76,0.00,0.00%,266433360.00,United States,2021,56025,,
PIPR,Piper Sandler Companies Common Stock,$124.80,1.89,1.538%,1793925744.00,United States,,126968,Finance,Investment Bankers/Brokers/Service
PJT,PJT Partners Inc. Class A Common Stock,$70.49,0.56,0.801%,2905624868.00,United States,2015,304021,Finance,Investment Managers
PK,Park Hotels & Resorts Inc. Common Stock ,$19.65,0.65,3.421%,4647038561.00,United States,2016,2646826,Consumer Services,Real Estate Investment Trusts
PKE,Park Aerospace Corp. Common Stock,$15.99,0.34,2.173%,325922187.00,United States,,60385,,
PKG,Packaging Corporation of America Common Stock,$138.63,2.50,1.836%,13169027370.00,United States,2000,422285,Basic Industries,Paper
PKI,PerkinElmer Inc. Common Stock,$153.96,0.03,0.019%,17257557303.00,United States,,433568,Health Care,Medical Specialities
PKO,Pimco Income Opportunity Fund Common Shares of Beneficial Interest,$26.65,-0.34,-1.26%,553508881.00,United States,,66464,Finance,Finance/Investors Services
PKX,POSCO Common Stock,$75.04,2.73,3.775%,22699771692.00,South Korea,1994,186360,Basic Industries,Steel/Iron Ore
PLAN,Anaplan Inc. Common Stock,$54.23,0.49,0.912%,7848816848.00,United States,2018,1036520,Technology,Computer Software: Prepackaged Software
PLD,Prologis Inc. Common Stock,$125.39,2.28,1.852%,92760136470.00,United States,,2311154,Consumer Services,Real Estate Investment Trusts
PLNT,Planet Fitness Inc. Common Stock,$73.86,1.45,2.002%,6395205252.00,United States,2015,756848,Consumer Services,Other Consumer Services
PLOW,Douglas Dynamics Inc. Common Stock,$40.48,0.72,1.811%,929237507.00,United States,2010,33922,Capital Goods,Construction/Ag Equipment/Trucks
PLTR,Palantir Technologies Inc. Class A Common Stock,$23.29,0.21,0.91%,43786995869.00,,2020,22413335,Technology,Retail: Computer Software & Peripheral Equipment
PLYM,Plymouth Industrial REIT Inc. Common Stock,$20.77,0.49,2.416%,610738091.00,United States,2017,191372,Consumer Services,Real Estate Investment Trusts
PM,Philip Morris International Inc Common Stock,$99.40,1.03,1.047%,154918577502.00,United States,,5059134,Consumer Non-Durables,Farming/Seeds/Milling
PMF,PIMCO Municipal Income Fund Common Stock,$15.22,-0.09,-0.588%,394822020.00,United States,2001,37801,Finance,Finance/Investors Services
PML,Pimco Municipal Income Fund II Common Shares of Beneficial Interest,$15.18,-0.13,-0.849%,956021220.00,United States,2002,145641,Finance,Investment Managers
PMM,Putnam Managed Municipal Income Trust Common Stock,$8.72,-0.055,-0.627%,426233609.00,United States,1989,54216,Finance,Investment Managers
PMO,Putnam Municipal Opportunities Trust Common Stock,$14.32,0.06,0.421%,488450704.00,United States,1993,98516,Finance,Finance Companies
PMT,PennyMac Mortgage Investment Trust Common Shares of Beneficial Interest,$21.01,0.62,3.041%,2057115341.00,United States,2009,879474,Consumer Services,Real Estate Investment Trusts
PMT^A,PennyMac Mortgage Investment Trust 8.125% Series A Fixed-to-Floating Rate Cumulative Redeemable Preferred Shares of Beneficial Interest,$26.76,0.1303,0.489%,,United States,,3327,,
PMT^B,PennyMac Mortgage Investment Trust 8.00% Series B Fixed-to-Floating Rate Cumulative Redeemable Preferred Shares of Beneficial Interest,$27.36,-0.04,-0.146%,,United States,,8425,,
PMVC,PMV Consumer Acquisition Corp. Class A Common Stock,$9.72,0.00,0.00%,212625000.00,United States,2020,14213,,
PMX,PIMCO Municipal Income Fund III Common Shares of Beneficial Interest,$13.08,-0.12,-0.909%,433667400.00,United States,2002,60658,Finance,Trusts Except Educational Religious and Charitable
PNC,PNC Financial Services Group Inc. (The) Common Stock,$189.67,6.44,3.515%,80582883055.00,United States,,1743984,Finance,Major Banks
PNC^P,PNC Financial Services Group Inc. (The) Depositary Shares Representing 1/4000th Perpetual Preferred Series P,$26.41,0.05,0.19%,,United States,,58095,,
PNF,PIMCO New York Municipal Income Fund Common Stock,$13.04,0.04,0.308%,102090160.00,United States,2001,4317,Finance,Finance Companies
PNI,Pimco New York Municipal Income Fund II Common Shares of Beneficial Interest,$11.96,-0.11,-0.911%,133820440.00,United States,2002,18204,Finance,Trusts Except Educational Religious and Charitable
PNM,PNM Resources Inc. (Holding Co.) Common Stock,$48.70,-0.08,-0.164%,4180158364.00,United States,,466153,Public Utilities,Electric Utilities: Central
PNR,Pentair plc. Ordinary Share,$69.30,1.03,1.509%,11517777256.00,Switzerland,,901848,Capital Goods,Fluid Controls
PNTM,Pontem Corporation Class A Ordinary Shares,$9.67,-0.02,-0.206%,834037500.00,,2021,2939,Finance,Business Services
PNW,Pinnacle West Capital Corporation Common Stock,$83.65,0.59,0.71%,9431617971.00,United States,,560674,Public Utilities,Electric Utilities: Central
POLY,Plantronics Inc. Common Stock,$36.37,1.45,4.152%,1538277915.00,United States,,417687,Public Utilities,Telecommunications Equipment
POND,Angel Pond Holdings Corporation,$9.71,9.71,,0.00,,,600,,
POR,Portland General Electric Co Common Stock,$46.42,0.72,1.575%,4159499286.00,United States,,340138,Public Utilities,Electric Utilities: Central
POST,Post Holdings Inc. Common Stock,$109.98,1.25,1.15%,6998008373.00,United States,2012,253773,Consumer Non-Durables,Specialty Foods
PPG,PPG Industries Inc. Common Stock,$171.41,2.44,1.444%,40639798992.00,United States,,852227,Basic Industries,Paints/Coatings
PPL,PPL Corporation Common Stock,$28.44,0.28,0.994%,21882528879.00,United States,,3634173,Public Utilities,Electric Utilities: Central
PPT,Putnam Premier Income Trust Common Stock,$4.71,-0.02,-0.423%,481419194.00,United States,1988,141510,Finance,Finance Companies
PPX,PPL Capital Funding Inc. 2013 Series B Junior Subordinated Notes due 2073,$25.33,-0.01,-0.039%,0.00,,,32056,Public Utilities,Electric Utilities: Central
PQG,PQ Group Holdings Inc. Common Stock,$15.04,0.39,2.662%,2059343848.00,United States,2017,117022,Basic Industries,Major Chemicals
PRA,ProAssurance Corporation Common Stock,$21.54,0.26,1.222%,1162156214.00,United States,,217598,Finance,Property-Casualty Insurers
PRE^J,PartnerRe Ltd. 4.875% Fixed Rate Non-Cumulative Redeemable Preferred Shares Series J,$27.64,-0.12,-0.432%,,Bermuda,,20315,,
PRG,PROG Holdings Inc. Common Stock,$46.07,1.69,3.808%,3119828520.00,United States,,371937,Technology,Diversified Commercial Services
PRGO,Perrigo Company plc Ordinary Shares,$46.74,0.12,0.257%,6242083251.00,United States,,1105911,Health Care,Major Pharmaceuticals
PRI,Primerica Inc. Common Stock,$147.40,4.42,3.091%,5813155451.00,United States,2010,114670,Finance,Life Insurance
PRIF^A,Priority Income Fund Inc. 6.375% Series A Term Preferred Stock due 2025,$25.16,0.00,0.00%,,,,680,,
PRIF^D,Priority Income Fund Inc. 7.00% Series D Term Preferred Stock due 2029,$26.07,0.27,1.047%,,,,801,,
PRIF^E,Priority Income Fund Inc. 6.375% Series E Preferred Stock Due 2024,$25.29,-0.005,-0.02%,,,,2760,,
PRIF^F,Priority Income Fund Inc. 6.625% Series F Term Preferred Stock due 2027,$25.8852,0.1452,0.564%,,,,5345,,
PRIF^G,Priority Income Fund Inc. 6.25% Series G Preferred Stock Due 2026,$25.95,0.00,0.00%,,,,25200,,
PRIF^H,Priority Income Fund Inc. 6.00% Series H Term Preferred Stock due 2026,$25.45,-0.027,-0.106%,,,,1799,,
PRIF^I,Priority Income Fund Inc. 6.125% Series I Term Preferred Stock due 2028,$25.4599,0.0199,0.078%,,,,5969,,
PRLB,Proto Labs Inc. Common stock,$92.67,2.17,2.398%,2566008762.00,United States,2012,232928,Capital Goods,Office Equipment/Supplies/Services
PRMW,Primo Water Corporation Common Stock,$16.38,0.22,1.361%,2639344371.00,Canada,,758353,Consumer Non-Durables,Beverages (Production/Distribution)
PRO,PROS Holdings Inc. Common Stock,$46.45,0.31,0.672%,2055545161.00,United States,2007,213261,Technology,EDP Services
PROS,ProSight Global Inc. Common Stock,$12.78,0.02,0.157%,559499658.00,United States,2019,18107,Finance,Property-Casualty Insurers
PRPB,CC Neuberger Principal Holdings II Class A Ordinary Shares,$9.83,-0.02,-0.203%,1066555000.00,United States,2020,185659,Finance,Business Services
PRPC,CC Neuberger Principal Holdings III Class A Ordinary Shares,$9.81,0.04,0.409%,542615625.00,,2021,26891,Finance,Business Services
PRS,Prudential Financial Inc. 5.625% Junior Subordinated Notes due 2058,$28.04,-0.06,-0.214%,955086339.00,United States,2018,9834,Finance,Investment Bankers/Brokers/Service
PRT,PermRock Royalty Trust Trust Units,$7.25,0.07,0.975%,88201557.00,United States,2018,31184,Energy,Oil & Gas Production
PRTY,Party City Holdco Inc. Common Stock,$9.17,0.32,3.616%,1020590702.00,United States,2015,1399020,Miscellaneous,Diversified Commercial Services
PRU,Prudential Financial Inc. Common Stock,$100.58,3.43,3.531%,39628520000.00,United States,2001,1999996,Finance,Life Insurance
PSA,Public Storage Common Stock,$311.68,4.50,1.465%,54537186675.00,United States,,517270,Consumer Services,Real Estate Investment Trusts
PSA^D,Public Storage Depositary Shares Each Representing 1/1000 of a 4.95% Cumulative Preferred Share of Beneficial Interest Series D,$25.05,0.00,0.00%,,United States,,85848,,
PSA^E,Public Storage Depositary Shares Each Representing 1/1000 of a 4.90% Cumulative Preferred Share of Beneficial Interest Series E,$25.54,-0.01,-0.039%,,United States,,11141,,
PSA^F,Public Storage Depositary Shares Each Representing 1/1000 of a 5.15% Cumulative Preferred Share of Beneficial Interest Series F par value $0.01 per share,$26.56,-0.10,-0.375%,,United States,,6652,,
PSA^G,Public Storage Depositary Shares Each Representing 1/1000 of a 5.05% Cumulative Preferred Share of Beneficial Interest Series G,$26.17,0.02,0.076%,,United States,,11054,,
PSA^H,Public Storage Depositary Shares Each Representing 1/1000 of a  5.60% Cumulative Preferred  Share of Beneficial Interest Series H,$28.45,-0.02,-0.07%,,United States,,10540,,
PSA^I,Public Storage Depositary Shares Each Representing 1/1000 of a 4.875% Cumulative Preferred Share of Beneficial Interest Series I par value $0.01 per share,$27.55,0.06,0.218%,,United States,,7100,,
PSA^J,Public Storage Depositary Shares Each Representing 1/1000 of a 4.700% Cumulative Preferred Share of Beneficial Interest Series J par value $0.01 per share,$27.86,0.06,0.216%,,United States,,5081,,
PSA^K,Public Storage Depositary Shares Each Representing 1/1000 of a 4.75% Cumulative Preferred Share of Beneficial Interest Series K,$27.72,0.01,0.036%,,United States,,45152,,
PSA^L,Public Storage Depositary Shares Each Representing 1/1000 of a 4.625% Cumulative Preferred Share of Beneficial Interest Series L par value $0.01 per share,$27.67,0.04,0.145%,,United States,,15103,,
PSA^M,Public Storage Depositary Shares Each Representing 1/1000 of a 4.125% Cumulative Preferred Share of Beneficial Interest Series M,$26.31,0.05,0.19%,,United States,,59225,,
PSA^N,Public Storage Depositary Shares Each Representing 1/1000 of a 3.875% Cumulative Preferred Share of Beneficial Interest Series N,$25.76,-0.03,-0.116%,,United States,,64497,,
PSA^O,Public Storage Depositary Shares Each Representing 1/1000 of a 3.900% Cumulative Preferred Share of Beneficial Interest Series O,$26.41,0.04,0.152%,,United States,,9160,,
PSA^P,Public Storage Depositary Shares Each Representing 1/1000 of a 4.000% Cumulative Preferred Share of Bene cial Interest Series P,$25.41,0.07,0.276%,,United States,,135482,,
PSB,PS Business Parks Inc. (MD) Common Stock,$153.37,2.02,1.335%,4222123804.00,United States,,57176,Consumer Services,Real Estate Investment Trusts
PSB^W,PS Business Parks Inc. Depositary Shares Each Representing 1/1000 of a Share of 5.20% Cumulative Preferred Stock Series W,$25.33,-0.06,-0.236%,,United States,,13121,,
PSB^X,PS Business Parks Inc. Depositary Shares Each Representing 1/1000 of a Share of 5.25% Cumulative Preferred Stock Series X,$26.57,-0.01,-0.038%,,United States,,15019,,
PSB^Y,PS Business Parks Inc. 5.20% Cumulative Preferred Stock Series Y,$26.79,-0.11,-0.409%,,United States,,59567,,
PSB^Z,PS Business Parks Inc. Depositary Shares Each Representing 1/1000 of a Share of 4.875% Cumulative Preferred Stock Series Z  par value $0.01 per share,$27.87,0.01,0.036%,,United States,,24355,,
PSF,Cohen & Steers Select Preferred and Income Fund Inc. Common Stock,$31.355,0.255,0.82%,376780117.00,,2010,14662,Finance,Investment Managers
PSFE,Paysafe Limited Common Shares,$11.52,0.36,3.226%,8337166641.00,,2021,3477264,Miscellaneous,Business Services
PSN,Parsons Corporation Common Stock,$40.39,0.42,1.051%,4136283677.00,,2019,211451,Capital Goods,Industrial Machinery/Components
PSO,Pearson Plc Common Stock,$11.54,0.21,1.853%,8726949454.00,United Kingdom,,272687,Consumer Services,Books
PSTG,Pure Storage Inc. Class A Common Stock,$19.22,0.38,2.017%,5444159293.00,,2015,2636833,Technology,Electronic Components
PSTH,Pershing Square Tontine Holdings Ltd. Class A Common Stock,$21.78,-0.14,-0.639%,4356002178.00,,2020,1967530,,
PSTL,Postal Realty Trust Inc. Class A Common Stock,$18.85,0.24,1.29%,252039995.00,,2019,55101,Consumer Services,Real Estate Investment Trusts
PSX,Phillips 66 Common Stock,$82.70,1.91,2.364%,36211605366.00,United States,,2376552,Energy,Integrated oil Companies
PSXP,Phillips 66 Partners LP Common Units representing limited partner interest in the Partnership,$39.53,0.53,1.359%,9026285971.00,United States,2013,335240,Energy,Oil & Gas Production
PTA,Cohen & Steers Tax-Advantaged Preferred Securities and Income Fund Common Shares of Beneficial Interest,$25.85,0.03,0.116%,1428818863.00,,2020,70878,Finance,Trusts Except Educational Religious and Charitable
PTR,PetroChina Company Limited Common Stock,$45.59,0.31,0.685%,83439263779.00,China,,270043,Energy,Oil & Gas Production
PTY,Pimco Corporate & Income Opportunity Fund,$19.84,-0.21,-1.047%,2194635546.00,United States,2002,302256,Finance,Investment Managers
PUK,Prudential Public Limited Company Common Stock,$38.37,1.52,4.125%,50180495539.00,United Kingdom,,354236,Finance,Life Insurance
PUK^,Prudential Public Limited Company 6.75% Perpetual Subordinated Captial Security,$27.37,0.37,1.37%,,United Kingdom,,20713,,
PUK^A,Prudential Public Limited Company 6.50% Perpetual Subordinated Capital Securities Exchangeable at the Issuer's Option Into Non-Cumulative Dollar Denominated Preference Shares,$27.00,0.29,1.086%,,United Kingdom,,10991,,
PUMP,ProPetro Holding Corp. Common Stock,$9.14,0.45,5.178%,934842225.00,United States,2017,927006,Energy,Oilfield Services/Equipment
PV,Primavera Capital Acquisition Corporation Class A Ordinary Shares,$9.66,-0.03,-0.31%,519225000.00,,2021,9462,Finance,Business Services
PVG,Pretium Resources Inc. Ordinary Shares (Canada),$9.34,0.08,0.864%,1754361005.00,Canada,,867895,,
PVH,PVH Corp. Common Stock,$108.05,5.09,4.944%,7710418827.00,United States,,863415,,
PVL,Permianville Royalty Trust Trust Units ,$1.95,0.05,2.632%,64350000.00,United States,2011,45616,Energy,Oil & Gas Production
PWR,Quanta Services Inc. Common Stock,$89.79,2.53,2.899%,12511885601.00,United States,,904198,Capital Goods,Engineering & Construction
PXD,Pioneer Natural Resources Company Common Stock,$158.00,0.76,0.483%,38544479358.00,United States,,1886327,Energy,Oil & Gas Production
PYN,PIMCO New York Municipal Income Fund III Common Shares of Beneficial Interest,$10.75,0.11,1.034%,61576000.00,United States,2002,103,Finance,Investment Managers
PYS,Merrill Lynch Depositor Inc PPlus Tr Ser RRD-1 Tr Ctf Cl A,$22.69,0.0955,0.423%,0.00,United States,,1217,Finance,Trusts Except Educational Religious and Charitable
PZC,PIMCO California Municipal Income Fund III Common Shares of Beneficial Interest,$11.64,-0.10,-0.852%,260514840.00,United States,2002,20888,Finance,Investment Managers
PZN,Pzena Investment Management Inc Class A Common Stock,$10.66,0.27,2.599%,773569753.00,United States,2007,58261,Finance,Investment Managers
QD,Qudian Inc. American Depositary Shares each representing one Class A Ordinary Share,$2.03,0.01,0.495%,513769042.00,China,2017,1858233,Technology,Computer Software: Prepackaged Software
QFTA,Quantum FinTech Acquisition Corporation Common Stock,$9.75,0.0361,0.372%,245273438.00,,2021,5530,,
QGEN,Qiagen N.V. Common Shares ,$50.52,0.12,0.238%,11539121640.00,Netherlands,,362756,Health Care,Biotechnology: Biological Products (No Diagnostic Substances)
QS,QuantumScape Corporation Class A Common Stock,$25.08,0.26,1.048%,10181826490.00,United States,2020,7427300,Capital Goods,Auto Parts:O.E.M.
QSR,Restaurant Brands International Inc. Common Shares,$64.32,0.57,0.894%,19496244819.00,Canada,2014,681990,,
QTS,QTS Realty Trust Inc. Class A Common Stock,$77.62,0.10,0.129%,5311491348.00,United States,2013,891507,Consumer Services,Real Estate Investment Trusts
QTS^A,QTS Realty Trust Inc. 7.125% Series A Cumulative Redeemable Perpetual Preferred Stock,$25.76,0.01,0.039%,,United States,,21479,,
QTS^B,QTS Realty Trust Inc. 6.50% Series B Cumulative Convertible Perpetual Preferred Stock,$171.25,0.275,0.161%,,United States,,30886,,
QTWO,Q2 Holdings Inc. Common Stock,$103.00,0.72,0.704%,5799446930.00,,2014,195414,Technology,EDP Services
QUAD,Quad Graphics Inc Class A Common Stock,$3.86,0.03,0.783%,211066367.00,United States,,182296,Consumer Services,Recreational Products/Toys
QUOT,Quotient Technology Inc. Common Stock,$11.10,0.53,5.014%,1036322973.00,,2014,570151,Technology,Advertising
QVCC,QVC Inc. 6.250% Senior Secured Notes due 2068,$26.27,0.02,0.076%,0.00,United States,2019,19237,,
QVCD,QVC Inc. 6.375% Senior Secured Notes due 2067,$26.36,0.01,0.038%,0.00,United States,2018,17694,,
R,Ryder System Inc. Common Stock,$73.86,2.16,3.013%,3978866784.00,United States,,389664,Miscellaneous,Rental/Leasing Companies
RA,Brookfield Real Assets Income Fund Inc. Common Stock,$22.39,0.10,0.449%,982762098.00,,2016,267631,Finance,Investment Managers
RAAS,Cloopen Group Holding Limited American Depositary Shares each representing two Class A Ordinary Shares,$6.73,0.16,2.435%,1106211271.00,,2021,579647,Technology,Computer Software: Prepackaged Software
RACE,Ferrari N.V. Common Shares,$209.08,3.42,1.663%,51807489532.00,,2015,244697,Capital Goods,Auto Manufacturing
RAD,Rite Aid Corporation Common Stock,$14.76,0.09,0.613%,813331232.00,United States,,2046121,Health Care,Medical/Nursing Services
RAMP,LiveRamp Holdings Inc. Common Stock,$43.87,0.70,1.621%,2997646357.00,United States,2018,309192,Technology,EDP Services
RBA,Ritchie Bros. Auctioneers Incorporated Common Stock,$59.67,0.73,1.239%,6580444058.00,Canada,,231400,,
RBAC,RedBall Acquisition Corp. Class A Ordinary Shares,$9.81,0.04,0.409%,705093750.00,United States,2020,393176,Finance,Business Services
RBC,Regal Beloit Corporation Common Stock,$133.01,5.06,3.955%,5404184994.00,United States,,396630,Consumer Durables,Metal Fabrications
RBLX,Roblox Corporation Class A Common Stock,$86.26,-0.62,-0.714%,49153661998.00,,2021,3933870,Technology,EDP Services
RC,Ready Capital Corproation Common Stock,$15.46,0.53,3.55%,1101087467.00,United States,2013,455508,Consumer Services,Real Estate Investment Trusts
RC^B,Ready Capital Corporation 8.625% Series B Cumulative Preferred Stock,$24.9901,-0.0098,-0.039%,,United States,,6668,,
RC^C,Ready Capital Corporation 6.25% Series C Cumulative Convertible Preferred Stock,$25.53,-0.20,-0.777%,,United States,,100,,
RC^D,Ready Capital Corporation 7.625% Series D Cumulative Redeemable Preferred Stock,$24.99,-0.01,-0.04%,,United States,,5555,,
RC^E,Ready Capital Corporation 6.50% Series E Cumulative Redeemable Preferred Stock,$25.22,0.06,0.238%,,United States,,23821,,
RCA,Ready Capital Corporation 7.00% Convertible Senior Notes due 2023,$27.00,0.024,0.089%,0.00,United States,2017,1970,Consumer Services,Real Estate Investment Trusts
RCB,Ready Capital Corporation 6.20% Senior Notes due 2026,$26.51,-0.16,-0.60%,0.00,United States,2019,332,,
RCC,Ready Capital Corporation 5.75% Senior Notes due 2026,$26.42,0.25,0.955%,,United States,2021,123108,Finance,Finance Companies
RCI,Rogers Communication Inc. Common Stock,$53.56,0.19,0.356%,27043800032.00,Canada,,188543,,
RCL,D/B/A Royal Caribbean Cruises Ltd. Common Stock,$82.33,2.88,3.625%,20958802191.00,United States,1993,2875475,,
RCS,PIMCO Strategic Income Fund Inc.,$7.65,-0.14,-1.797%,339131201.00,United States,1994,107964,Finance,Investment Managers
RCUS,Arcus Biosciences Inc. Common Stock,$29.07,0.32,1.113%,2063849650.00,,2018,726939,Health Care,Major Pharmaceuticals
RDN,Radian Group Inc. Common Stock,$22.17,0.54,2.497%,4241488069.00,United States,,1824357,Finance,Property-Casualty Insurers
RDS/B,Royal Dutch Shell PLC,$39.70,0.55,1.405%,,Netherlands,,2730146,,
RDY,Dr. Reddy's Laboratories Ltd Common Stock,$73.96,0.35,0.475%,12261453645.00,India,,81530,Health Care,Major Pharmaceuticals
RE,Everest Re Group Ltd. Common Stock,$247.86,4.87,2.004%,9935102507.00,Bermuda,,282347,Finance,Property-Casualty Insurers
RELX,RELX PLC PLC American Depositary Shares (Each representing One Ordinary Share),$27.90,0.42,1.528%,53939261701.00,United Kingdom,2015,577030,Consumer Services,Publishing
RENN,Renren Inc. American Depositary Shares each representing fifteen Class A ordinary shares,$11.48,0.00,0.00%,275742207.00,China,2011,22623,Technology,EDP Services
RERE,AiHuiShou International Co. Ltd. American Depositary Shares (every three of which representing two Class A ordinary shares),$14.12,0.53,3.90%,3143603884.00,,2021,292072,,
RES,RPC Inc. Common Stock,$4.96,0.22,4.641%,1070045719.00,United States,,665766,Energy,Oilfield Services/Equipment
REV,Revlon Inc. New Common Stock,$12.43,-0.13,-1.035%,664835604.00,United States,1996,109585,Consumer Non-Durables,Package Goods/Cosmetics
REVG,REV Group Inc. Common Stock,$16.40,0.68,4.326%,1061767094.00,United States,2017,326349,Capital Goods,Auto Manufacturing
REX,REX American Resources Corporation,$87.56,7.14,8.878%,524659520.00,United States,,28538,Basic Industries,Automotive Aftermarket
REXR,Rexford Industrial Realty Inc. Common Stock,$58.76,0.80,1.38%,7877503627.00,United States,2013,1371300,Consumer Services,Real Estate Investment Trusts
REXR^A,Rexford Industrial Realty Inc. 5.875% Series A Cumulative Redeemable Preferred Stock,$25.18,0.01,0.04%,,United States,,11720,,
REXR^B,Rexford Industrial Realty Inc. 5.875% Series B Cumulative Redeemable Preferred Stock,$26.4601,-0.0399,-0.151%,,United States,,102,,
REXR^C,Rexford Industrial Realty Inc. 5.625% Series C Cumulative Redeemable Preferred Stock par value $0.01 per share,$27.5926,0.0125,0.045%,,United States,,979,,
REZI,Resideo Technologies Inc. Common Stock ,$29.43,0.99,3.481%,4233517066.00,,2018,308658,Miscellaneous,Diversified Manufacture
RF,Regions Financial Corporation Common Stock,$19.87,0.90,4.744%,19100740819.00,United States,,8324470,Finance,Major Banks
RF^B,Regions Financial Corporation Depositary Shares Representing 1/40th Perpetual Preferred Series B,$29.13,0.10,0.344%,,United States,,28977,,
RF^C,Regions Financial Corporation Depositary Shares each Representing a 1/40th Interest in a  Share of 5.700% Fixed-to-Floating Rate Non-Cumulative  Perpetual Preferred Stock Series C,$29.55,-0.03,-0.101%,,United States,,25516,,
